{"checks":{"authority_binding":true,"record_integrity":true,"scope_binding":true,"source_binding":true},"decision_authority":"project_owner","effect":"record_only","finalization_hash":"sha256:55c86f8589300918c4b9207544575240f685948ee7c0afe382b17e79c92e9357","finalization_id":"2c891750-d1a3-562a-ba3d-75900626a740","finalization_state":"finalized","finalized_by":{"authority_name":"thomasverburgt","authority_role":"project-owner","subject_id":"HUMAN-PROJECT-OWNER-001"},"finalized_on":"2026-08-02","target_record_hash":"sha256:2112f3259e6c92c014e8c44a379a52c0fe957f43cce231df53560875ed7e6cc6","target_record_id":"5e03ee9f-d4be-5661-952e-360a734bfab3","target_record_type":"enterprise_strategy_semantic_disposition"}
